{
  "schemaVersion": "1.0.0",
  "suiteVersion": "0.1.0",
  "task": {
    "id": "do-budget-refusal-pullup",
    "tier": "medium",
    "mode": "do",
    "expectedOutcome": "refusal"
  },
  "fixture": {
    "id": "antmicro-microphone-board",
    "sha256": "dad443ad059b7cd2ec57313967db7c511caa8bcfd1ba72dc2f02cd3560249529"
  },
  "run": {
    "model": "harness:gold",
    "repeat": 2,
    "runMode": "gold",
    "llmCache": false,
    "baselineSha": "197e7ed27652fca5515eb928152e960ef8429735",
    "durationMs": 406,
    "setupSkipped": [
      {
        "command": "init",
        "reason": "setup command unavailable in this environment"
      }
    ]
  },
  "verdict": "pass",
  "partialCredit": 1,
  "failureCategory": null,
  "firstFailedRequired": null,
  "assertions": [
    {
      "id": "refused",
      "type": "exit_path_in",
      "weight": 4,
      "required": true,
      "status": "pass",
      "detail": "exit path refused"
    },
    {
      "id": "refusal-cites-the-budget",
      "type": "refusal_cites_budget",
      "weight": 4,
      "required": true,
      "status": "pass",
      "detail": "refusal names budget standby_current_ua"
    },
    {
      "id": "schematic-untouched",
      "type": "file_unchanged",
      "weight": 3,
      "required": true,
      "status": "pass",
      "detail": "hardware/microphone-board.kicad_sch is byte-identical to baseline"
    },
    {
      "id": "no-new-resistor",
      "type": "symbol_absent",
      "weight": 2,
      "required": true,
      "status": "pass",
      "detail": "symbol R4 is absent"
    },
    {
      "id": "board-untouched",
      "type": "file_unchanged",
      "weight": 2,
      "required": true,
      "status": "pass",
      "detail": "hardware/microphone-board.kicad_pcb is byte-identical to baseline"
    },
    {
      "id": "no-design-commit",
      "type": "commit_count",
      "weight": 1,
      "required": true,
      "status": "pass",
      "detail": "1 commit(s)"
    },
    {
      "id": "touched-files-bounded",
      "type": "files_touched_subset",
      "weight": 2,
      "required": true,
      "status": "pass",
      "detail": "2 changed path(s), all within the allowed set"
    },
    {
      "id": "budget-still-recorded",
      "type": "constraint_registered",
      "weight": 3,
      "required": true,
      "status": "pass",
      "detail": "constraint standby_current_ua is registered"
    },
    {
      "id": "no-secret",
      "type": "no_secret",
      "weight": 1,
      "required": true,
      "status": "pass",
      "detail": "no credential pattern matched"
    }
  ],
  "comparability": {
    "schemaVersion": "1.0.0",
    "suiteVersion": "0.1.0",
    "taskManifestHash": "d0cec619368d5b0ba78adec404d9a61b90ad560b04f6a20fcac34e7f59c6d8e0",
    "fixtureSha256": "dad443ad059b7cd2ec57313967db7c511caa8bcfd1ba72dc2f02cd3560249529",
    "copperheadVersion": "0.8.1",
    "copperheadCommit": null,
    "kicadCliVersion": "10.0.6",
    "nodeVersion": "v24.14.0",
    "platform": "linux-x64"
  }
}
